{
  "$schema": "../../../schemas/language/numeric-array-shape-inferred-evidence-r1.schema.json",
  "schema": "deeplus.numeric-array-shape-inferred-evidence/r1",
  "revision": "r56-local-numeric-array-shape-inferred-closure-r1",
  "canonical_baseline_commit": "39a5d50cc770341c4b9776d00d84520b780d0c62",
  "local_predecessor_commit": "f4e194d414a024b1fbf93549cdbe3d0cc59fb810",
  "candidate_status": "NONCANONICAL_DESIGN_STATIC_EVIDENCE_OVERLAY",
  "feature_ids": [
    "numeric_array_shape_inferred_column_vector_semicolon_msp",
    "numeric_array_shape_inferred_value_literal",
    "numeric_array_vector_orientation_witness_msp"
  ],
  "evidence_entries": [
    {
      "evidence_key": "R56:numeric_array_shape_inferred_column_vector_semicolon_msp:CONFORMANCE_TESTS:BOUNDARY",
      "class": "ACCEPTANCE_CASE",
      "path": "spec/contracts/numeric-array-shape-inferred-literal-r1.json",
      "locator_kind": "JSON_POINTER",
      "locator": "/acceptance_cases/5",
      "stage_role": "CONFORMANCE_TESTS:BOUNDARY"
    },
    {
      "evidence_key": "R56:numeric_array_shape_inferred_column_vector_semicolon_msp:CONFORMANCE_TESTS:REJECT",
      "class": "ACCEPTANCE_CASE",
      "path": "spec/contracts/numeric-array-shape-inferred-literal-r1.json",
      "locator_kind": "JSON_POINTER",
      "locator": "/acceptance_cases/6",
      "stage_role": "CONFORMANCE_TESTS:REJECT"
    },
    {
      "evidence_key": "R56:numeric_array_shape_inferred_column_vector_semicolon_msp:DYNAMIC_LOWERING:STRUCTURAL",
      "class": "CONTRACT_RULE_ID",
      "path": "spec/contracts/numeric-array-shape-inferred-literal-r1.json",
      "locator_kind": "REGISTRY_ID",
      "locator": "NASIL-R009",
      "stage_role": "DYNAMIC_LOWERING"
    },
    {
      "evidence_key": "R56:numeric_array_shape_inferred_value_literal:CONFORMANCE_TESTS:BOUNDARY",
      "class": "ACCEPTANCE_CASE",
      "path": "spec/contracts/numeric-array-shape-inferred-literal-r1.json",
      "locator_kind": "JSON_POINTER",
      "locator": "/acceptance_cases/1",
      "stage_role": "CONFORMANCE_TESTS:BOUNDARY"
    },
    {
      "evidence_key": "R56:numeric_array_shape_inferred_value_literal:CONFORMANCE_TESTS:POSITIVE",
      "class": "ACCEPTANCE_CASE",
      "path": "spec/contracts/numeric-array-shape-inferred-literal-r1.json",
      "locator_kind": "JSON_POINTER",
      "locator": "/acceptance_cases/0",
      "stage_role": "CONFORMANCE_TESTS:POSITIVE"
    },
    {
      "evidence_key": "R56:numeric_array_shape_inferred_value_literal:CONFORMANCE_TESTS:REJECT",
      "class": "ACCEPTANCE_CASE",
      "path": "spec/contracts/numeric-array-shape-inferred-literal-r1.json",
      "locator_kind": "JSON_POINTER",
      "locator": "/acceptance_cases/2",
      "stage_role": "CONFORMANCE_TESTS:REJECT"
    },
    {
      "evidence_key": "R56:numeric_array_shape_inferred_value_literal:DYNAMIC_LOWERING:STRUCTURAL",
      "class": "CONTRACT_RULE_ID",
      "path": "spec/contracts/numeric-array-shape-inferred-literal-r1.json",
      "locator_kind": "REGISTRY_ID",
      "locator": "NASIL-R008",
      "stage_role": "DYNAMIC_LOWERING"
    },
    {
      "evidence_key": "R56:numeric_array_vector_orientation_witness_msp:CONFORMANCE_TESTS:BOUNDARY",
      "class": "ACCEPTANCE_CASE",
      "path": "spec/contracts/numeric-array-shape-inferred-literal-r1.json",
      "locator_kind": "JSON_POINTER",
      "locator": "/acceptance_cases/8",
      "stage_role": "CONFORMANCE_TESTS:BOUNDARY"
    },
    {
      "evidence_key": "R56:numeric_array_vector_orientation_witness_msp:CONFORMANCE_TESTS:REJECT",
      "class": "ACCEPTANCE_CASE",
      "path": "spec/contracts/numeric-array-shape-inferred-literal-r1.json",
      "locator_kind": "JSON_POINTER",
      "locator": "/acceptance_cases/9",
      "stage_role": "CONFORMANCE_TESTS:REJECT"
    },
    {
      "evidence_key": "R56:numeric_array_vector_orientation_witness_msp:DYNAMIC_LOWERING:STRUCTURAL",
      "class": "CONTRACT_RULE_ID",
      "path": "spec/contracts/numeric-array-shape-inferred-literal-r1.json",
      "locator_kind": "REGISTRY_ID",
      "locator": "NASIL-R012",
      "stage_role": "DYNAMIC_LOWERING"
    }
  ],
  "bindings": [
    {
      "feature_id": "numeric_array_shape_inferred_column_vector_semicolon_msp",
      "stage": "CONFORMANCE_TESTS",
      "outcome": "BOUNDARY",
      "disposition": "BOUND_DIRECT",
      "evidence_keys": [
        "R56:numeric_array_shape_inferred_column_vector_semicolon_msp:CONFORMANCE_TESTS:BOUNDARY"
      ],
      "delegate_feature_id": null,
      "not_applicable": null
    },
    {
      "feature_id": "numeric_array_shape_inferred_column_vector_semicolon_msp",
      "stage": "CONFORMANCE_TESTS",
      "outcome": "REJECT",
      "disposition": "BOUND_DIRECT",
      "evidence_keys": [
        "R56:numeric_array_shape_inferred_column_vector_semicolon_msp:CONFORMANCE_TESTS:REJECT"
      ],
      "delegate_feature_id": null,
      "not_applicable": null
    },
    {
      "feature_id": "numeric_array_shape_inferred_column_vector_semicolon_msp",
      "stage": "DYNAMIC_LOWERING",
      "outcome": null,
      "disposition": "BOUND_DIRECT",
      "evidence_keys": [
        "R56:numeric_array_shape_inferred_column_vector_semicolon_msp:DYNAMIC_LOWERING:STRUCTURAL"
      ],
      "delegate_feature_id": null,
      "not_applicable": null
    },
    {
      "feature_id": "numeric_array_shape_inferred_value_literal",
      "stage": "CONFORMANCE_TESTS",
      "outcome": "BOUNDARY",
      "disposition": "BOUND_DIRECT",
      "evidence_keys": [
        "R56:numeric_array_shape_inferred_value_literal:CONFORMANCE_TESTS:BOUNDARY"
      ],
      "delegate_feature_id": null,
      "not_applicable": null
    },
    {
      "feature_id": "numeric_array_shape_inferred_value_literal",
      "stage": "CONFORMANCE_TESTS",
      "outcome": "POSITIVE",
      "disposition": "BOUND_DIRECT",
      "evidence_keys": [
        "R56:numeric_array_shape_inferred_value_literal:CONFORMANCE_TESTS:POSITIVE"
      ],
      "delegate_feature_id": null,
      "not_applicable": null
    },
    {
      "feature_id": "numeric_array_shape_inferred_value_literal",
      "stage": "CONFORMANCE_TESTS",
      "outcome": "REJECT",
      "disposition": "BOUND_DIRECT",
      "evidence_keys": [
        "R56:numeric_array_shape_inferred_value_literal:CONFORMANCE_TESTS:REJECT"
      ],
      "delegate_feature_id": null,
      "not_applicable": null
    },
    {
      "feature_id": "numeric_array_shape_inferred_value_literal",
      "stage": "DYNAMIC_LOWERING",
      "outcome": null,
      "disposition": "BOUND_DIRECT",
      "evidence_keys": [
        "R56:numeric_array_shape_inferred_value_literal:DYNAMIC_LOWERING:STRUCTURAL"
      ],
      "delegate_feature_id": null,
      "not_applicable": null
    },
    {
      "feature_id": "numeric_array_vector_orientation_witness_msp",
      "stage": "CONFORMANCE_TESTS",
      "outcome": "BOUNDARY",
      "disposition": "BOUND_DIRECT",
      "evidence_keys": [
        "R56:numeric_array_vector_orientation_witness_msp:CONFORMANCE_TESTS:BOUNDARY"
      ],
      "delegate_feature_id": null,
      "not_applicable": null
    },
    {
      "feature_id": "numeric_array_vector_orientation_witness_msp",
      "stage": "CONFORMANCE_TESTS",
      "outcome": "REJECT",
      "disposition": "BOUND_DIRECT",
      "evidence_keys": [
        "R56:numeric_array_vector_orientation_witness_msp:CONFORMANCE_TESTS:REJECT"
      ],
      "delegate_feature_id": null,
      "not_applicable": null
    },
    {
      "feature_id": "numeric_array_vector_orientation_witness_msp",
      "stage": "DYNAMIC_LOWERING",
      "outcome": null,
      "disposition": "BOUND_DIRECT",
      "evidence_keys": [
        "R56:numeric_array_vector_orientation_witness_msp:DYNAMIC_LOWERING:STRUCTURAL"
      ],
      "delegate_feature_id": null,
      "not_applicable": null
    }
  ],
  "acceptance_cases": [
    {
      "case_id": "R56-TRACE-001",
      "feature_id": "numeric_array_shape_inferred_column_vector_semicolon_msp",
      "outcome": "BOUNDARY",
      "contract_pointer": "/acceptance_cases/5",
      "expected": "ADMIT",
      "diagnostic_or_null": null,
      "execution_state": "DESIGN_STATIC_NOT_RUN"
    },
    {
      "case_id": "R56-TRACE-002",
      "feature_id": "numeric_array_shape_inferred_column_vector_semicolon_msp",
      "outcome": "REJECT",
      "contract_pointer": "/acceptance_cases/6",
      "expected": "REJECT",
      "diagnostic_or_null": "COLUMN_VECTOR_SEMICOLON_ORIENTATION_LAW_REQUIRED",
      "execution_state": "DESIGN_STATIC_NOT_RUN"
    },
    {
      "case_id": "R56-TRACE-003",
      "feature_id": "numeric_array_shape_inferred_value_literal",
      "outcome": "BOUNDARY",
      "contract_pointer": "/acceptance_cases/1",
      "expected": "ADMIT",
      "diagnostic_or_null": null,
      "execution_state": "DESIGN_STATIC_NOT_RUN"
    },
    {
      "case_id": "R56-TRACE-004",
      "feature_id": "numeric_array_shape_inferred_value_literal",
      "outcome": "POSITIVE",
      "contract_pointer": "/acceptance_cases/0",
      "expected": "ADMIT",
      "diagnostic_or_null": null,
      "execution_state": "DESIGN_STATIC_NOT_RUN"
    },
    {
      "case_id": "R56-TRACE-005",
      "feature_id": "numeric_array_shape_inferred_value_literal",
      "outcome": "REJECT",
      "contract_pointer": "/acceptance_cases/2",
      "expected": "REJECT",
      "diagnostic_or_null": "SHARP_SHAPE_LITERAL_EMPTY_FORBIDDEN",
      "execution_state": "DESIGN_STATIC_NOT_RUN"
    },
    {
      "case_id": "R56-TRACE-006",
      "feature_id": "numeric_array_vector_orientation_witness_msp",
      "outcome": "BOUNDARY",
      "contract_pointer": "/acceptance_cases/8",
      "expected": "ADMIT",
      "diagnostic_or_null": null,
      "execution_state": "DESIGN_STATIC_NOT_RUN"
    },
    {
      "case_id": "R56-TRACE-007",
      "feature_id": "numeric_array_vector_orientation_witness_msp",
      "outcome": "REJECT",
      "contract_pointer": "/acceptance_cases/9",